request_id,title,agency,date_sent,due_date,status,response_url,notes
OIA-001,Current capitation formula and calculation basis,Ministry of Health,2026-05-31,2026-06-29,Sent,,Filed via online form. Expect response by late June.
OIA-002,"PHO roles, functions and options for change H2025067082",Ministry of Health,2026-05-31,2026-06-29,Sent,,Filed via online form. Expect response by late June.
OIA-003,"Primary care payment flows, PHO pass-through and provider onboarding",Health New Zealand,2026-05-31,2026-06-29,Sent,,Filed via email. Expect response by late June.
OIA-004,National Primary Care Dataset metadata and aggregate access data,Health New Zealand,2026-05-31,2026-06-29,Sent,,Filed via email. Expect response by late June.
OIA-005,"Ambulance conveyance, alternative disposition and handover indicators",Health New Zealand / Ambulance Team,2026-05-31,2026-06-29,Sent,,Filed via email. Expect response by late June.
OIA-006,ACC primary care treatment payments by provider type and region,ACC,2026-05-31,2026-06-29,Sent,,Filed via email request. Expect response by late June.
